ids,plain_text,No,sentences,anncomplete_1,entities_1,relations_1,1_Relevant_1,Action1-PentaClass_1,Action1_CAMEO_1,Action2-PentaClass_1,Action2_CAMEO_1,Action3-PentaClass_1,Action3_CAMEO_1,anncomplete_2,entities_2,relations_2,anncomplete_3,entities_3,relations_3,1_Relevant_3,Action1-PentaClass_3,Action1_CAMEO_3,Action2-PentaClass_3,Action2_CAMEO_3,Action3_CAMEO_3,Action3-PentaClass_3,anncomplete_4,entities_4,relations_4,1_Relevant_4,Action1-PentaClass_4,Action1_CAMEO_4,Action2-PentaClass_4,Action2_CAMEO_4,Action3-PentaClass_4,Action3_CAMEO_4,anncomplete_5,entities_5,relations_5,1_Relevant_5,Action1-PentaClass_5,Action1_CAMEO_5,Action2-PentaClass_5,Action2_CAMEO_5,Action3-PentaClass_5,Action3_CAMEO_5,Action4-PentaClass_5,Action4_CAMEO_5
anZouS_A7ubdO9kFslHtDoHkfLkO-cameo_100.csv_27,"No. 57 sentences MOSCOW, Sept. 24 -- President Vladimir V. Putin tonight offered the United States broad support for antiterrorist operations in Afghanistan, including access to its airspace for humanitarian missions, direct participation in some search-and-rescue operation",No. 57 ,"MOSCOW, Sept. 24 -- President Vladimir V. Putin tonight offered the United States broad support for antiterrorist operations in Afghanistan, including access to its airspace for humanitarian missions, direct participation in some search-and-rescue operation",True,"[('Location', 'MOSCOW', 0), ('Time', 'Sept. 24', 8), ('Source-1', 'President Vladimir V. Putin', 20), ('Action-1', 'offered', 56), ('Target-1', 'United States', 68)]","[[('Action-1', 'offered'), ('Source-1', 'President Vladimir V. Putin')], [('Target-1', 'United States'), ('Action-1', 'offered')]]",True,1-Verbal Cooperation,1-3 Express Intent to Coop,,,,,False,[],[],True,"[('Location', 'MOSCOW', 0), ('Time', 'Sept. 24', 8), ('Source-1', 'President Vladimir V. Putin', 20), ('Time', 'tonight', 48), ('Action-1', 'offered', 56), ('Target-1', 'United States', 68), ('Action-1', 'broad support for antiterrorist operations in Afghanistan', 82), ('Action-1', 'access to its airspace for humanitarian missions', 151), ('Action-1', 'direct participation in some search-and-rescue operation', 201)]","[[('Source-1', 'President Vladimir V. Putin'), ('Action-1', 'offered')], [('Source-1', 'President Vladimir V. Putin'), ('Action-1', 'broad support for antiterrorist operations in Afghanistan')], [('Source-1', 'President Vladimir V. Putin'), ('Action-1', 'access to its airspace for humanitarian missions')], [('Source-1', 'President Vladimir V. Putin'), ('Action-1', 'direct participation in some search-and-rescue operation')], [('Action-1', 'offered'), ('Target-1', 'United States')], [('Action-1', 'broad support for antiterrorist operations in Afghanistan'), ('Target-1', 'United States')], [('Action-1', 'access to its airspace for humanitarian missions'), ('Target-1', 'United States')], [('Action-1', 'direct participation in some search-and-rescue operation'), ('Target-1', 'United States')]]",True,2-Material Cooperation,2-6 Engage in Material Coop,,,,,True,"[('Location', 'MOSCOW', 0), ('Time', 'Sept. 24', 8), ('Source-1', 'President Vladimir V. Putin', 20), ('Action-1', 'offered the United States', 56), ('Target-1', 'broad support for antiterrorist operations in Afghanistan', 82)]","[[('Source-1', 'President Vladimir V. Putin'), ('Action-1', 'offered the United States')], [('Action-1', 'offered the United States'), ('Target-1', 'broad support for antiterrorist operations in Afghanistan')]]",True,1-Verbal Cooperation,2-6 Engage in Material Coop,,,,,True,"[('Source-1', 'President Vladimir V. Putin', 20), ('Time', 'tonight', 48), ('Action-1', 'offered', 56), ('Target-1', 'United States', 68)]","[[('Source-1', 'President Vladimir V. Putin'), ('Action-1', 'offered')], [('Action-1', 'offered'), ('Target-1', 'United States')]]",True,1-Verbal Cooperation,1-3 Express Intent to Coop,,,,,,
a6RYM4HXQ_oVRHF2JHzZgX2LSpOC-cameo_100.csv_20,"No. 27 sentences President Trump offered on day 29 of a partial government shutdown what he described as a proposal to end the impasse, but it was one that House Speaker Nancy Pelosi had already rejected before his announcement.",No. 27 ,"President Trump offered on day 29 of a partial government shutdown what he described as a proposal to end the impasse, but it was one that House Speaker Nancy Pelosi had already rejected before his announcement.",True,"[('Source-1', 'President Trump', 0), ('Action-1', 'offered', 16), ('Source-2', 'House Speaker Nancy Pelosi', 139), ('Action-2', 'already rejected', 170)]",[],True,1-Verbal Cooperation,1-3 Express Intent to Coop,3-Verbal Conflict,3-12 Reject,,,False,[],[],True,"[('Source-1', 'President Trump', 0), ('Action-1', 'offered', 16), ('Time', 'day 29', 27), ('Target-1', 'partial government shutdown', 39), ('Action-1', 'proposal to end', 90), ('Target-2', 'proposal to end', 90), ('Source-2', 'House Speaker Nancy Pelosi', 139), ('Action-2', 'rejected', 178)]","[[('Source-1', 'President Trump'), ('Action-1', 'offered')], [('Source-1', 'President Trump'), ('Action-1', 'proposal to end')], [('Action-1', 'proposal to end'), ('Target-1', 'partial government shutdown')], [('Source-2', 'House Speaker Nancy Pelosi'), ('Action-2', 'rejected')], [('Action-2', 'rejected'), ('Target-2', 'proposal to end')]]",True,1-Verbal Cooperation,1-3 Express Intent to Coop,3-Verbal Conflict,3-12 Reject,,,True,"[('Source-1', 'President Trump', 0), ('Action-1', 'offered', 16), ('Target-1', 'proposal to end the impasse', 90), ('Target-2', 'proposal to end the impasse,', 90), ('Source-2', 'House Speaker Nancy Pelosi', 139), ('Action-2', 'rejected', 178)]","[[('Source-1', 'President Trump'), ('Action-1', 'offered')], [('Action-1', 'offered'), ('Target-1', 'proposal to end the impasse')], [('Source-2', 'House Speaker Nancy Pelosi'), ('Action-2', 'rejected')], [('Action-2', 'rejected'), ('Target-2', 'proposal to end the impasse,')]]",True,1-Verbal Cooperation,1-3 Express Intent to Coop,3-Verbal Conflict,3-12 Reject,,,True,"[('Source-1', 'President Trump', 0), ('Target-2', 'President Trump', 0), ('Action-1', 'offered', 16), ('Target-1', 'House Speaker Nancy Pelosi', 139), ('Source-2', 'House Speaker Nancy Pelosi', 139), ('Action-2', 'had already rejected', 166)]","[[('Source-1', 'President Trump'), ('Action-1', 'offered')], [('Source-2', 'House Speaker Nancy Pelosi'), ('Action-2', 'had already rejected')], [('Action-2', 'had already rejected'), ('Source-1', 'President Trump')], [('Action-1', 'offered'), ('Source-2', 'House Speaker Nancy Pelosi')]]",True,1-Verbal Cooperation,1-3 Express Intent to Coop,3-Verbal Conflict,3-12 Reject,,,,
acR8A_Grucj2eFDBtwq9JjxZMffu-cameo_100.csv_24,"No. 81 sentences LAHORE: Imran Khan did not talk about rigging for a year but then a section of establishment had conspired and launched him and Dr Tahirul Qadri, said Najam Sethi on Friday.",No. 81 ,"LAHORE: Imran Khan did not talk about rigging for a year but then a section of establishment had conspired and launched him and Dr Tahirul Qadri, said Najam Sethi on Friday.",True,"[('Target-1', 'Imran Khan', 8), ('Action-1', 'did not talk about rigging for a year', 19), ('Source-1', 'section of establishment', 68), ('Action-2', 'conspired and launched', 97), ('Target-1', 'him', 120), ('Target-2', 'Dr Tahirul Qadri', 128)]","[[('Action-1', 'did not talk about rigging for a year'), ('Target-1', 'Imran Khan')], [('Action-2', 'conspired and launched'), ('Target-2', 'Dr Tahirul Qadri')], [('Source-1', 'section of establishment'), ('Action-2', 'conspired and launched')], [('Action-2', 'conspired and launched'), ('Target-1', 'him')], [('Action-2', 'conspired and launched'), ('Target-1', 'Imran Khan')]]",True,0-Make a Statement,0-1 Make Public Statement,4-Material Conflict,4-14 Protest,,,False,[],[],True,"[('Location', 'LAHORE', 0), ('Target-1', 'Imran Khan', 8), ('Source-1', 'a section of establishment', 66), ('Action-1', 'conspired and launched', 97), ('Target-2', 'Dr Tahirul Qadri', 128), ('Action-2', 'said', 146), ('Source-2', 'Najam Sethi', 151), ('Time', 'Friday', 166)]","[[('Source-1', 'a section of establishment'), ('Action-1', 'conspired and launched')], [('Action-1', 'conspired and launched'), ('Target-1', 'Imran Khan')], [('Source-2', 'Najam Sethi'), ('Action-2', 'said')], [('Action-1', 'conspired and launched'), ('Target-2', 'Dr Tahirul Qadri')]]",True,4-Material Conflict,4-14 Protest,0-Make a Statement,0-1 Make Public Statement,,,True,"[('Location', 'LAHORE', 0), ('Target-1', 'Imran Khan', 8), ('Source-1', 'section of establishment', 68), ('Action-1', 'conspired and launched', 97), ('Target-1', 'him', 120), ('Target-1', 'Dr Tahirul Qadri', 128), ('Action-2', 'said', 146), ('Source-2', 'Najam Sethi', 151), ('Time', 'Friday', 166)]","[[('Source-1', 'section of establishment'), ('Action-1', 'conspired and launched')], [('Action-1', 'conspired and launched'), ('Target-1', 'Imran Khan')], [('Action-1', 'conspired and launched'), ('Target-1', 'him')], [('Action-1', 'conspired and launched'), ('Target-1', 'Dr Tahirul Qadri')], [('Source-2', 'Najam Sethi'), ('Action-2', 'said')]]",True,4-Material Conflict,4-14 Protest,0-Make a Statement,0-1 Make Public Statement,,,True,"[('Location', 'LAHORE', 0), ('Target-1', 'Imran Khan', 8), ('Source-1', 'section of establishment', 68), ('Action-1', 'launched', 111), ('Target-1', 'Dr Tahirul Qadri', 128), ('Action-2', 'said', 146), ('Source-2', 'Najam Sethi', 151), ('Time', 'Friday', 166)]","[[('Source-1', 'section of establishment'), ('Action-1', 'launched')], [('Action-1', 'launched'), ('Target-1', 'Imran Khan')], [('Action-1', 'launched'), ('Target-1', 'Dr Tahirul Qadri')], [('Source-2', 'Najam Sethi'), ('Action-2', 'said')]]",True,3-Verbal Conflict,3-16 Reduce Relations,0-Make a Statement,0-1 Make Public Statement,,,,
arsDU3OA8Ax8qnQL2JTHB1.3KRgS-cameo_100.csv_23,No. 43 sentences PHILADELPHIA - It was supposed to be a day dedicated to working better together.,No. 43 ,PHILADELPHIA - It was supposed to be a day dedicated to working better together.,True,[],[],False,,,,,,,False,[],[],True,[],[],False,,,,,,,True,[],[],False,,,,,,,True,[],[],False,,,,,,,,
acKPY4Sp8WiL1g.Zq_37Ert21E3y-cameo_100.csv_18,"No. 5 sentences The Obama administration has begun discussions with the Senate about whether a bill aimed at forcing China to let its currency rise is ""the right approach"" to the long-running currency issue, a top U.S. official said Tuesday.",No. 5 ,"The Obama administration has begun discussions with the Senate about whether a bill aimed at forcing China to let its currency rise is ""the right approach"" to the long-running currency issue, a top U.S. official said Tuesday.",True,"[('Source-1', 'Obama administration', 4), ('Action-1', 'has begun discussions', 25), ('Target-1', 'Senate', 56), ('Action-2', 'bill aimed at forcing', 79), ('Target-2', 'China', 101), ('Source-3', 'top U.S. official', 194), ('Action-3', 'said', 212), ('Time', 'Tuesday', 217)]",[],True,1-Verbal Cooperation,1-4 Consult,3-Verbal Conflict,3-13 Threaten,0-Make a Statement,0-1 Make Public Statement,False,[],[],True,"[('Source-1', 'Obama administration', 4), ('Action-1', 'discussions', 35), ('Target-1', 'Senate', 56), ('Action-2', 'forcing', 93), ('Target-2', 'China', 101), ('Source-2', 'top U.S. official', 194), ('Action-3', 'said', 212), ('Time', 'Tuesday', 217)]","[[('Source-1', 'Obama administration'), ('Action-1', 'discussions')], [('Action-1', 'discussions'), ('Target-1', 'Senate')], [('Action-2', 'forcing'), ('Target-2', 'China')], [('Source-1', 'Obama administration'), ('Action-2', 'forcing')], [('Source-2', 'top U.S. official'), ('Action-3', 'said')]]",True,1-Verbal Cooperation,1-3 Express Intent to Coop,3-Verbal Conflict,3-10 Demand,0-1 Make Public Statement,0-Make a Statement,True,"[('Source-1', 'Obama administration', 4), ('Action-1', 'begun discussions', 29), ('Target-1', 'Senate', 56), ('Source-2', 'a top U.S. official', 192), ('Action-2', 'said', 212), ('Time', 'Tuesday', 217)]","[[('Source-1', 'Obama administration'), ('Action-1', 'begun discussions')], [('Action-1', 'begun discussions'), ('Target-1', 'Senate')], [('Source-2', 'a top U.S. official'), ('Action-2', 'said')]]",True,1-Verbal Cooperation,1-5 Engage in Dip Coop,0-Make a Statement,0-1 Make Public Statement,,,True,"[('Source-1', 'Obama administration', 4), ('Action-1', 'has begun discussions', 25), ('Target-1', 'Senate', 56), ('Source-2', 'top U.S. official', 194), ('Action-2', 'said', 212), ('Time', 'Tuesday', 217)]","[[('Source-1', 'Obama administration'), ('Action-1', 'has begun discussions')], [('Action-1', 'has begun discussions'), ('Target-1', 'Senate')], [('Source-2', 'top U.S. official'), ('Action-2', 'said')]]",True,1-Verbal Cooperation,1-4 Consult,0-Make a Statement,0-1 Make Public Statement,,,,
apEU3AZiwduYWOBKXeqoKqRQ86xi-cameo_100.csv_21,"No. 35 sentences  As with most prominent statesmen, the figure of former Israeli President Shimon Peres has not been exempt from criticism and controversy, especially by those who saw him as one of the main stalwarts of Israel's contentious securit",No. 35 ," As with most prominent statesmen, the figure of former Israeli President Shimon Peres has not been exempt from criticism and controversy, especially by those who saw him as one of the main stalwarts of Israel's contentious securit",True,[],[],False,,,,,,,False,[],[],True,[],[],False,,,,,,,True,[],[],False,,,,,,,True,[],[],False,,,,,,,,
aHflVynSQtot85rhiOg3KTIiev0a-cameo_100.csv_19,"No. 18 sentences Over the past 18 months, President Dmitry Medvedev has signed two laws meant to rein in Russia's notorious pretrial detention system, an institution often used to extract bribes and enforce widespread corruption.",No. 18 ,"Over the past 18 months, President Dmitry Medvedev has signed two laws meant to rein in Russia's notorious pretrial detention system, an institution often used to extract bribes and enforce widespread corruption.",True,"[('Source-1', 'President Dmitry Medvedev', 25), ('Action-1', 'has signed', 51), ('Action-2', 'rein in', 80), ('Target-1', 'pretrial detention system', 107)]","[[('Source-1', 'President Dmitry Medvedev'), ('Action-1', 'has signed')], [('Action-2', 'rein in'), ('Target-1', 'pretrial detention system')]]",True,2-Material Cooperation,2-6 Engage in Material Coop,4-Material Conflict,3-16 Reduce Relations,,,False,[],[],True,"[('Time', 'Over the past 18 months', 0), ('Source-1', 'President Dmitry Medvedev', 25), ('Action-1', 'signed two laws meant to rein in', 55), ('Target-1', ""Russia's notorious pretrial detention system"", 88), ('Location', 'Russia', 88)]","[[('Source-1', 'President Dmitry Medvedev'), ('Action-1', 'signed two laws meant to rein in')], [('Action-1', 'signed two laws meant to rein in'), ('Target-1', ""Russia's notorious pretrial detention system"")]]",True,3-Verbal Conflict,3-10 Demand,,,,,True,"[('Time', 'Over the past 18 months', 0), ('Source-1', 'President Dmitry Medvedev', 25), ('Action-1', 'has signed two laws', 51), ('Target-1', ""to rein in Russia's notorious pretrial detention system"", 77)]","[[('Source-1', 'President Dmitry Medvedev'), ('Action-1', 'has signed two laws')], [('Action-1', 'has signed two laws'), ('Target-1', ""to rein in Russia's notorious pretrial detention system"")]]",True,2-Material Cooperation,2-6 Engage in Material Coop,,,,,True,"[('Time', 'Over the past 18 months', 0), ('Source-1', 'President Dmitry Medvedev', 25), ('Action-1', 'has signed', 51), ('Target-1', 'laws', 66), ('Action-2', 'rein in', 80), ('Target-2', ""Russia's notorious pretrial detention system"", 88)]","[[('Source-1', 'President Dmitry Medvedev'), ('Action-1', 'has signed')], [('Action-1', 'has signed'), ('Target-1', 'laws')], [('Action-2', 'rein in'), ('Target-2', ""Russia's notorious pretrial detention system"")], [('Source-1', 'President Dmitry Medvedev'), ('Action-2', 'rein in')]]",True,2-Material Cooperation,2-6 Engage in Material Coop,4-Material Conflict,4-17 Coerce,,,,
a8tMGyBftm0dff7JkPJuOYwwmKrK-cameo_100.csv_17,"No. 28 sentences The oil portrait ""Girl from the Sabine Mountains"" shows a peasant woman reclining, closing her eyes and stretching her billowing white sleeves behind her dark hair.",No. 28 ,"The oil portrait ""Girl from the Sabine Mountains"" shows a peasant woman reclining, closing her eyes and stretching her billowing white sleeves behind her dark hair.",True,[],[],False,,,,,,,False,[],[],True,[],[],False,,,,,,,True,[],[],False,,,,,,,True,[],[],False,,,,,,,,
aW.lnjBFti919Cqr7jpFQtn9pmFa-cameo_100.csv_12,No. 68 sentences It's not clear what exact words David Cameron used in private conversation but many Muslim women have taken to Twitter to tell him that they are not quite the timid creatures he is reported to have portrayed them as.,No. 68 ,It's not clear what exact words David Cameron used in private conversation but many Muslim women have taken to Twitter to tell him that they are not quite the timid creatures he is reported to have portrayed them as.,True,"[('Target-1', 'David Cameron', 32), ('Source-1', 'Muslim women', 84), ('Action-1', 'have taken to Twitter to tell him that they are not quite the timid creatures', 97)]","[[('Source-1', 'Muslim women'), ('Action-1', 'have taken to Twitter to tell him that they are not quite the timid creatures')]]",True,3-Verbal Conflict,3-11 Disapprove,,,,,False,[],[],True,"[('Target-1', 'David Cameron', 32), ('Source-1', 'Muslim women', 84), ('Action-1', 'taken to Twitter to tell him that they are not quite the timid creatures he is reported to have portrayed them as', 102)]","[[('Source-1', 'Muslim women'), ('Action-1', 'taken to Twitter to tell him that they are not quite the timid creatures he is reported to have portrayed them as')], [('Action-1', 'taken to Twitter to tell him that they are not quite the timid creatures he is reported to have portrayed them as'), ('Target-1', 'David Cameron')]]",True,3-Verbal Conflict,3-11 Disapprove,,,,,True,"[('Target-1', 'David Cameron', 32), ('Source-1', 'Muslim women', 84), ('Action-1', 'have taken to Twitter to tell', 97), ('Target-1', 'him', 127)]","[[('Source-1', 'Muslim women'), ('Action-1', 'have taken to Twitter to tell')], [('Action-1', 'have taken to Twitter to tell'), ('Target-1', 'David Cameron')], [('Action-1', 'have taken to Twitter to tell'), ('Target-1', 'him')]]",True,3-Verbal Conflict,3-11 Disapprove,,,,,True,"[('Target-1', 'David Cameron', 32), ('Source-1', 'Muslim women', 84), ('Action-1', 'have taken to Twitter to tell', 97)]","[[('Source-1', 'Muslim women'), ('Action-1', 'have taken to Twitter to tell')], [('Action-1', 'have taken to Twitter to tell'), ('Target-1', 'David Cameron')]]",True,3-Verbal Conflict,3-11 Disapprove,,,,,,
a6jDI8CIjNdlFQRx8mgognO8dzU0-cameo_100.csv_13,"No. 32 sentences HONG KONG, March 21 (Xinhua) -- Carrie Lam, the chief executive of the Hong Kong Special Administrative Region (HKSAR), said on Saturday that she was confident that Hong Kong will thrive and soar higher with the full support of the central authorities.",No. 32 ,"HONG KONG, March 21 (Xinhua) -- Carrie Lam, the chief executive of the Hong Kong Special Administrative Region (HKSAR), said on Saturday that she was confident that Hong Kong will thrive and soar higher with the full support of the central authorities.",True,"[('Location', 'HONG KONG', 0), ('Time', 'March 21', 11), ('Source-1', 'hief executive of the Hong Kong Special Administrative Region', 49), ('Source-1', 'HKSAR', 112), ('Action-1', 'said', 120), ('Target-1', 'Hong Kong', 165), ('Action-2', 'thrive and soar higher with the full support of the central authorities', 180)]","[[('Source-1', 'hief executive of the Hong Kong Special Administrative Region'), ('Action-1', 'said')], [('Action-2', 'thrive and soar higher with the full support of the central authorities'), ('Target-1', 'Hong Kong')]]",True,0-Make a Statement,0-1 Make Public Statement,0-Make a Statement,0-1 Make Public Statement,,,False,[],[],True,"[('Location', 'HONG KONG', 0), ('Time', 'March 21', 11), ('Source-1', 'Carrie Lam, the chief executive of the Hong Kong Special Administrative Region', 32), ('Action-1', 'said', 120), ('Time', 'Saturday', 128), ('Action-1', 'confident that Hong Kong will thrive and soar higher', 150)]","[[('Source-1', 'Carrie Lam, the chief executive of the Hong Kong Special Administrative Region'), ('Action-1', 'said')], [('Source-1', 'Carrie Lam, the chief executive of the Hong Kong Special Administrative Region'), ('Action-1', 'confident that Hong Kong will thrive and soar higher')]]",True,0-Make a Statement,0-1 Make Public Statement,,,,,True,"[('Location', 'HONG KONG', 0), ('Time', 'March 21', 11), ('Source-1', 'Carrie Lam, the chief executive of the Hong Kong Special Administrative Region', 32), ('Action-1', 'said', 120), ('Time', 'Saturday', 128)]","[[('Source-1', 'Carrie Lam, the chief executive of the Hong Kong Special Administrative Region'), ('Action-1', 'said')]]",True,0-Make a Statement,0-1 Make Public Statement,,,,,True,"[('Location', 'HONG KONG', 0), ('Source-1', 'Carrie Lam, the chief executive of the Hong Kong Special Administrative Region', 32), ('Action-1', 'said', 120), ('Time', 'Saturday', 128), ('Target-2', 'Hong Kong', 165), ('Action-2', 'with the full support', 203), ('Source-2', 'central authorities', 232)]","[[('Source-1', 'Carrie Lam, the chief executive of the Hong Kong Special Administrative Region'), ('Action-1', 'said')], [('Source-2', 'central authorities'), ('Action-2', 'with the full support')], [('Action-2', 'with the full support'), ('Target-2', 'Hong Kong')]]",True,0-Make a Statement,0-1 Make Public Statement,2-Material Cooperation,2-7 Provide Aid,,,,
aiRxJ8eDlObp5C8cyvAf666xGJaC-cameo_100.csv_16,"No. 92 sentences PESHAWAR: A US drone killed three suspected militants in an attack on a compound in the Kurram Agency on Friday, officials said, in the first strike since President Donald Trump vowed to crack down on the country.",No. 92 ,"PESHAWAR: A US drone killed three suspected militants in an attack on a compound in the Kurram Agency on Friday, officials said, in the first strike since President Donald Trump vowed to crack down on the country.",True,"[('Source-1', 'US drone', 12), ('Action-1', 'killed', 21), ('Target-1', 'suspected militants', 34), ('Action-1', 'attack', 60), ('Location', 'compound in the Kurram Agency', 72), ('Time', 'Friday', 105), ('Target-2', 'officials', 113), ('Time', 'f', 115), ('Action-2', 'said', 123), ('Source-3', 'President Donald Trump', 155), ('Action-3', 'vowed to crack down', 178), ('Target-3', 'country', 205)]","[[('Source-1', 'US drone'), ('Action-1', 'killed')], [('Action-1', 'killed'), ('Target-1', 'suspected militants')], [('Action-1', 'attack'), ('Target-1', 'suspected militants')], [('Source-3', 'President Donald Trump'), ('Action-3', 'vowed to crack down')], [('Target-3', 'country'), ('Action-3', 'vowed to crack down')]]",True,4-Material Conflict,4-18 Assualt,0-Make a Statement,0-1 Make Public Statement,3-Verbal Conflict,3-13 Threaten,False,[],[],True,"[('Location', 'PESHAWAR', 0), ('Source-1', 'US drone', 12), ('Action-1', 'killed', 21), ('Target-1', 'suspected militants', 34), ('Action-1', 'attack', 60), ('Target-1', 'compound', 72), ('Location', 'Kurram Agency', 88), ('Time', 'Friday', 105), ('Source-2', 'officials', 113), ('Action-2', 'said', 123), ('Action-1', 'strike', 142), ('Action-1', 'vowed to crack down', 178)]","[[('Source-1', 'US drone'), ('Action-1', 'killed')], [('Source-1', 'US drone'), ('Action-1', 'attack')], [('Source-1', 'US drone'), ('Action-1', 'strike')], [('Action-1', 'killed'), ('Target-1', 'suspected militants')], [('Action-1', 'attack'), ('Target-1', 'compound')], [('Action-1', 'strike'), ('Target-1', 'compound')], [('Action-1', 'strike'), ('Target-1', 'suspected militants')], [('Source-2', 'officials'), ('Action-2', 'said')]]",True,4-Material Conflict,4-19 Fight,0-Make a Statement,0-1 Make Public Statement,,,True,"[('Location', 'PESHAWAR', 0), ('Source-1', 'US drone', 12), ('Action-1', 'killed', 21), ('Target-1', 'three suspected militants', 28), ('Action-1', 'attack on a compound', 60), ('Location', 'Kurram Agency', 88), ('Time', 'Friday', 105), ('Source-3', 'officials', 113), ('Action-3', 'said', 123), ('Action-1', 'strike', 142), ('Source-2', 'President Donald Trump', 155), ('Action-2', 'vowed to crack down', 178), ('Location', 'country', 205)]","[[('Source-1', 'US drone'), ('Action-1', 'killed')], [('Source-1', 'US drone'), ('Action-1', 'attack on a compound')], [('Source-1', 'US drone'), ('Action-1', 'strike')], [('Action-1', 'attack on a compound'), ('Target-1', 'three suspected militants')], [('Action-1', 'strike'), ('Target-1', 'three suspected militants')], [('Source-2', 'President Donald Trump'), ('Action-2', 'vowed to crack down')], [('Source-3', 'officials'), ('Action-3', 'said')]]",True,4-Material Conflict,4-19 Fight,3-Verbal Conflict,3-13 Threaten,0-Make a Statement,0-1 Make Public Statement,True,"[('Source-1', 'US drone', 12), ('Action-1', 'killed', 21), ('Target-1', 'suspected militants', 34), ('Action-1', 'attack', 60), ('Target-1', 'compound in the Kurram Agency', 72), ('Location', 'compound in the Kurram Agency', 72), ('Time', 'Friday', 105), ('Source-2', 'officials', 113), ('Action-2', 'said', 123), ('Source-3', 'President Donald Trump', 155), ('Action-3', 'vowed', 178)]","[[('Source-1', 'US drone'), ('Action-1', 'killed')], [('Source-1', 'US drone'), ('Action-1', 'attack')], [('Action-1', 'killed'), ('Target-1', 'suspected militants')], [('Action-1', 'attack'), ('Target-1', 'compound in the Kurram Agency')], [('Source-2', 'officials'), ('Action-2', 'said')], [('Source-3', 'President Donald Trump'), ('Action-3', 'vowed')]]",True,4-Material Conflict,4-18 Assualt,0-Make a Statement,0-1 Make Public Statement,0-Make a Statement,0-1 Make Public Statement,,
