ids,plain_text,No,sentences,anncomplete_1,entities_1,relations_1,1_Relevant_1,Action1-PentaClass_1,Action1_CAMEO_1,Action2-PentaClass_1,Action2_CAMEO_1,Action3-PentaClass_1,Action3_CAMEO_1,anncomplete_2,entities_2,relations_2,anncomplete_3,entities_3,relations_3,1_Relevant_3,Action1-PentaClass_3,Action1_CAMEO_3,Action2-PentaClass_3,Action2_CAMEO_3,Action3_CAMEO_3,Action3-PentaClass_3,anncomplete_4,entities_4,relations_4,1_Relevant_4,Action1-PentaClass_4,Action1_CAMEO_4,Action2-PentaClass_4,Action2_CAMEO_4,Action3-PentaClass_4,Action3_CAMEO_4,anncomplete_5,entities_5,relations_5,1_Relevant_5,Action1-PentaClass_5,Action1_CAMEO_5,Action2-PentaClass_5,Action2_CAMEO_5,Action3-PentaClass_5,Action3_CAMEO_5,Action4-PentaClass_5,Action4_CAMEO_5
asNXqxy4ZUpemAtH8tXNJ1SndIqu-cameo_100.csv_40,"No. 48 sentences NOWSHERA: District and Sessions Judge of Nowshera, Shafiq Ahmad Tanoli, Friday suspended a clerk and launched a probe after the District Bar Association boycotted courts to protest the lock-down of the courts by the clerical staff the previous day.",No. 48 ,"NOWSHERA: District and Sessions Judge of Nowshera, Shafiq Ahmad Tanoli, Friday suspended a clerk and launched a probe after the District Bar Association boycotted courts to protest the lock-down of the courts by the clerical staff the previous day.",True,"[('Location', 'NOWSHERA', 0), ('Source-1', 'District and Sessions Judge of Nowshera, Shafiq Ahmad Tanoli', 10), ('Time', 'Friday', 72), ('Action-1', 'suspended', 79), ('Target-1', 'clerk', 91), ('Action-1', 'launched a probe', 101), ('Source-2', 'District Bar Association', 128), ('Action-2', 'boycotted', 153), ('Target-2', 'courts', 163), ('Action-2', 'protest', 173)]","[[('Source-1', 'District and Sessions Judge of Nowshera, Shafiq Ahmad Tanoli'), ('Action-1', 'launched a probe')], [('Action-1', 'suspended'), ('Target-1', 'clerk')], [('Source-2', 'District Bar Association'), ('Action-2', 'boycotted')], [('Action-2', 'boycotted'), ('Target-2', 'courts')]]",True,3-Verbal Conflict,3-11 Disapprove,4-Material Conflict,4-14 Protest,,,False,[],[],True,"[('Location', 'NOWSHERA', 0), ('Source-1', 'District and Sessions Judge of Nowshera, Shafiq Ahmad Tanoli', 10), ('Time', 'Friday', 72), ('Action-1', 'launched a probe', 101), ('Source-2', 'District Bar Association', 128), ('Action-2', 'boycotted', 153), ('Target-1', 'courts', 163), ('Action-3', 'protest', 173)]","[[('Source-1', 'District and Sessions Judge of Nowshera, Shafiq Ahmad Tanoli'), ('Action-1', 'launched a probe')], [('Source-2', 'District Bar Association'), ('Action-2', 'boycotted')], [('Source-2', 'District Bar Association'), ('Action-3', 'protest')], [('Action-2', 'boycotted'), ('Target-1', 'courts')], [('Action-3', 'protest'), ('Target-1', 'courts')]]",True,3-Verbal Conflict,3-9 Investigate,3-Verbal Conflict,3-10 Demand,4-14 Protest,4-Material Conflict,True,"[('Location', 'NOWSHERA', 0), ('Source-1', 'District and Sessions Judge of Nowshera, Shafiq Ahmad Tanoli', 10), ('Time', 'Friday', 72), ('Action-1', 'suspended', 79), ('Target-1', 'suspended', 79), ('Target-1', 'a clerk', 89), ('Source-2', 'District Bar Association', 128), ('Action-2', 'boycotted courts to protest', 153), ('Target-2', 'the lock-down of the courts by the clerical staff the previous day.', 181)]","[[('Source-1', 'District and Sessions Judge of Nowshera, Shafiq Ahmad Tanoli'), ('Action-1', 'suspended')], [('Action-1', 'suspended'), ('Target-1', 'a clerk')], [('Source-2', 'District Bar Association'), ('Action-2', 'boycotted courts to protest')], [('Action-2', 'boycotted courts to protest'), ('Target-2', 'the lock-down of the courts by the clerical staff the previous day.')]]",True,4-Material Conflict,4-17 Coerce,4-Material Conflict,4-14 Protest,,,True,"[('Location', 'NOWSHERA', 0), ('Source-1', 'District and Sessions Judge of Nowshera, Shafiq Ahmad Tanoli', 10), ('Time', 'Friday', 72), ('Action-1', 'suspended', 79), ('Target-1', 'clerk', 91), ('Action-2', 'launched a probe', 101), ('Source-3', 'District Bar Association', 128), ('Action-3', 'boycotted', 153), ('Target-3', 'courts', 163), ('Action-3', 'protest', 173), ('Action-4', 'lock-down', 185), ('Target-3', 'courts', 202), ('Source-4', 'clerical staff', 216), ('Target-3', 'clerical staff', 216)]","[[('Source-1', 'District and Sessions Judge of Nowshera, Shafiq Ahmad Tanoli'), ('Action-1', 'suspended')], [('Action-1', 'suspended'), ('Target-1', 'clerk')], [('Source-3', 'District Bar Association'), ('Action-3', 'boycotted')], [('Source-3', 'District Bar Association'), ('Action-3', 'protest')], [('Action-3', 'boycotted'), ('Target-3', 'courts')], [('Action-3', 'boycotted'), ('Target-3', 'courts')], [('Source-4', 'clerical staff'), ('Action-4', 'lock-down')], [('Source-1', 'District and Sessions Judge of Nowshera, Shafiq Ahmad Tanoli'), ('Action-2', 'launched a probe')], [('Action-3', 'protest'), ('Source-4', 'clerical staff')], [('Action-4', 'lock-down'), ('Target-3', 'courts')], [('Action-4', 'lock-down'), ('Target-3', 'courts')]]",True,4-Material Conflict,4-17 Coerce,3-Verbal Conflict,3-9 Investigate,4-Material Conflict,4-14 Protest,4-Material Conflict,4-17 Coerce
aIH2LspdeOY9SyS_Vqldcy6ZhTbC-cameo_100.csv_39,No. 2 sentences WASHINGTON--A tremendous number of personnel records--including some quite personal records--have likely been stolen by computer hackers.,No. 2 ,WASHINGTON--A tremendous number of personnel records--including some quite personal records--have likely been stolen by computer hackers.,True,[],[],False,,,,,,,False,[],[],True,[],[],False,,,,,,,True,[],[],False,,,,,,,True,[],[],False,,,,,,,,
aJQFZYIQWYtT0qem1VRvHxagoZO8-cameo_100.csv_34,"No. 71 sentences NEW YORK -- St. Joe Minerals Corp. said Monday it has filed suit in federal court in Kansas City to block the $2 billion takeover bid by Joseph E. Seagram & Sons, Inc., the U.S. subsidiary of Canada's Seagram empire.",No. 71 ,"NEW YORK -- St. Joe Minerals Corp. said Monday it has filed suit in federal court in Kansas City to block the $2 billion takeover bid by Joseph E. Seagram & Sons, Inc., the U.S. subsidiary of Canada's Seagram empire.",True,[],[],False,,,,,,,False,[],[],True,[],[],False,,,,,,,True,[],[],False,,,,,,,True,[],[],False,,,,,,,,
a.ASK1QSYAtd.kuzmE4kykZekk3e-cameo_100.csv_37,"No. 52 sentences GUATEMALA CITY -- Gunmen released two priests kidnapped earlier this week in a bloody raid that left a parish clerk dead, said Catholic Church officials, who declined to reveal details of the case.",No. 52 ,"GUATEMALA CITY -- Gunmen released two priests kidnapped earlier this week in a bloody raid that left a parish clerk dead, said Catholic Church officials, who declined to reveal details of the case.",True,"[('Location', 'GUATEMALA CITY', 0), ('Source-1', 'Gunmen', 18), ('Action-1', 'released', 25), ('Target-1', 'priests', 38), ('Action-2', 'kidnapped', 46), ('Time', 'earlier this week', 56), ('Action-2', 'raid', 86), ('Target-2', 'parish clerk', 103), ('Action-3', 'dead', 116), ('Action-4', 'said', 122), ('Source-3', 'Catholic Church officials', 127)]","[[('Source-1', 'Gunmen'), ('Action-1', 'released')], [('Target-1', 'priests'), ('Action-1', 'released')], [('Target-1', 'priests'), ('Action-2', 'kidnapped')], [('Source-3', 'Catholic Church officials'), ('Action-4', 'said')]]",True,2-Material Cooperation,2-8 Yield,4-Material Conflict,4-18 Assualt,0-Make a Statement,0-1 Make Public Statement,False,[],[],True,"[('Location', 'GUATEMALA CITY', 0), ('Source-1', 'Gunmen', 18), ('Action-1', 'released', 25), ('Target-1', 'priests', 38), ('Action-2', 'kidnapped', 46), ('Time', 'earlier this week', 56), ('Source-2', 'raid', 86), ('Target-2', 'parish clerk', 103), ('Action-2', 'dead', 116), ('Action-3', 'said', 122), ('Source-3', 'Catholic Church officials', 127)]","[[('Source-1', 'Gunmen'), ('Action-1', 'released')], [('Action-1', 'released'), ('Target-1', 'priests')], [('Source-2', 'raid'), ('Action-2', 'kidnapped')], [('Source-2', 'raid'), ('Action-2', 'dead')], [('Action-2', 'dead'), ('Target-2', 'parish clerk')], [('Source-3', 'Catholic Church officials'), ('Action-3', 'said')], [('Action-2', 'kidnapped'), ('Target-1', 'priests')]]",True,2-Material Cooperation,2-8 Yield,4-Material Conflict,4-18 Assualt,0-1 Make Public Statement,0-Make a Statement,True,"[('Location', 'GUATEMALA CITY', 0), ('Source-1', 'Gunmen', 18), ('Action-1', 'released', 25), ('Target-1', 'two priests kidnapped earlier this week', 34), ('Target-1', 'earlier', 56), ('Action-2', 'said', 122), ('Source-2', 'Catholic Church officials', 127)]","[[('Source-1', 'Gunmen'), ('Action-1', 'released')], [('Action-1', 'released'), ('Target-1', 'two priests kidnapped earlier this week')], [('Source-2', 'Catholic Church officials'), ('Action-2', 'said')]]",True,2-Material Cooperation,2-8 Yield,0-Make a Statement,0-1 Make Public Statement,,,True,"[('Location', 'GUATEMALA CITY', 0), ('Source-1', 'Gunmen', 18), ('Action-1', 'released', 25), ('Target-1', 'priests', 38), ('Action-2', 'kidnapped', 46), ('Time', 'earlier this week', 56), ('Action-3', 'said', 122), ('Source-3', 'Catholic Church officials', 127)]","[[('Source-1', 'Gunmen'), ('Action-1', 'released')], [('Action-1', 'released'), ('Target-1', 'priests')], [('Source-3', 'Catholic Church officials'), ('Action-3', 'said')], [('Source-1', 'Gunmen'), ('Action-2', 'kidnapped')], [('Action-2', 'kidnapped'), ('Target-1', 'priests')]]",True,2-Material Cooperation,2-8 Yield,4-Material Conflict,4-18 Assualt,0-Make a Statement,0-1 Make Public Statement,,
aAyTnsODdKlteQvMxa0fxCpk9Mfa-cameo_100.csv_35,"No. 93 sentences KOLKO, Philip - Born August 1935, passed away June 27, 2004, after a long and courageous battle against cancer.",No. 93 ,"KOLKO, Philip - Born August 1935, passed away June 27, 2004, after a long and courageous battle against cancer.",True,[],[],False,,,,,,,False,[],[],True,[],[],False,,,,,,,True,[],[],False,,,,,,,True,[],[],False,,,,,,,,
a81vbsZ6ecQCr2XTupwHCrifTBS8-cameo_100.csv_28,"No. 16 sentences MINGORA, Pakistan (Reuters) - A suicide bomber killed five people and wounded 40 in an attack on a security forces' convoy in Pakistan's Swat valley on Thursday, officials and witnesses said.",No. 16 ,"MINGORA, Pakistan (Reuters) - A suicide bomber killed five people and wounded 40 in an attack on a security forces' convoy in Pakistan's Swat valley on Thursday, officials and witnesses said.",True,"[('Location', 'MINGORA, Pakistan', 0), ('Source-1', 'suicide bomber', 32), ('Action-1', 'killed', 47), ('Target-1', 'people', 59), ('Action-2', 'wounded', 70), ('Action-3', 'attack', 87), ('Target-2', ""security forces' convoy"", 99)]","[[('Source-1', 'suicide bomber'), ('Action-1', 'killed')], [('Action-1', 'killed'), ('Target-1', 'people')], [('Action-3', 'attack'), ('Source-1', 'suicide bomber')], [('Action-2', 'wounded'), ('Target-1', 'people')]]",True,4-Material Conflict,4-18 Assualt,4-Material Conflict,4-18 Assualt,4-Material Conflict,4-18 Assualt,False,[],[],True,"[('Location', 'MINGORA, Pakistan', 0), ('Source-1', 'suicide bomber', 32), ('Action-1', 'killed', 47), ('Target-1', 'people', 59), ('Action-1', 'wounded', 70), ('Target-1', '40', 78), ('Action-1', 'attack', 87), ('Target-1', ""security forces' convoy"", 99), ('Location', ""Pakistan's Swat valley"", 126), ('Time', 'Thursday', 152), ('Source-2', 'officials', 162), ('Source-2', 'witnesses', 176), ('Action-2', 'said', 186)]","[[('Source-1', 'suicide bomber'), ('Action-1', 'killed')], [('Source-1', 'suicide bomber'), ('Action-1', 'wounded')], [('Source-1', 'suicide bomber'), ('Action-1', 'attack')], [('Action-1', 'killed'), ('Target-1', 'people')], [('Action-1', 'wounded'), ('Target-1', '40')], [('Action-1', 'attack'), ('Target-1', ""security forces' convoy"")], [('Source-2', 'officials'), ('Action-2', 'said')], [('Source-2', 'witnesses'), ('Action-2', 'said')]]",True,4-Material Conflict,4-18 Assualt,0-Make a Statement,0-1 Make Public Statement,,,True,"[('Location', 'MINGORA, Pakistan', 0), ('Source-1', 'A suicide bomber', 30), ('Action-1', 'killed', 47), ('Target-1', 'five people', 54), ('Action-1', 'wounded', 70), ('Target-1', '40', 78), ('Action-1', 'attack', 87), ('Target-1', ""security forces' convoy"", 99), ('Location', ""Pakistan's Swat valley"", 126), ('Time', 'Thursday', 152), ('Source-2', 'officials and witnesses', 162), ('Action-2', 'said', 186)]","[[('Source-1', 'A suicide bomber'), ('Action-1', 'killed')], [('Source-1', 'A suicide bomber'), ('Action-1', 'wounded')], [('Source-1', 'A suicide bomber'), ('Action-1', 'attack')], [('Action-1', 'killed'), ('Target-1', 'five people')], [('Action-1', 'wounded'), ('Target-1', '40')], [('Action-1', 'attack'), ('Target-1', ""security forces' convoy"")], [('Source-2', 'officials and witnesses'), ('Action-2', 'said')]]",True,4-Material Conflict,4-19 Fight,0-Make a Statement,0-1 Make Public Statement,,,True,"[('Source-1', 'suicide bomber', 32), ('Action-1', 'killed', 47), ('Target-1', 'people', 59), ('Action-1', 'wounded', 70), ('Action-1', 'attack', 87), ('Target-1', ""security forces' convoy"", 99), ('Location', ""Pakistan's Swat valley"", 126), ('Time', 'Thursday', 152), ('Source-2', 'officials', 162), ('Source-2', 'witnesses', 176), ('Action-2', 'said', 186)]","[[('Source-1', 'suicide bomber'), ('Action-1', 'killed')], [('Source-1', 'suicide bomber'), ('Action-1', 'wounded')], [('Source-1', 'suicide bomber'), ('Action-1', 'attack')], [('Action-1', 'killed'), ('Target-1', 'people')], [('Action-1', 'wounded'), ('Target-1', 'people')], [('Action-1', 'attack'), ('Target-1', ""security forces' convoy"")], [('Source-2', 'officials'), ('Action-2', 'said')], [('Source-2', 'witnesses'), ('Action-2', 'said')]]",True,4-Material Conflict,4-18 Assualt,0-Make a Statement,0-1 Make Public Statement,,,,
a_EZ.k3TuBIqqVMU8U0tv1JI1TU4-cameo_100.csv_31,"No. 66 sentences ""We have no confirmation that missiles reached our exclusive economic zone. At this moment, we can say that there is no direct threat to our country,"" Kyodo quoted a source in the government as saying.",No. 66 ,"""We have no confirmation that missiles reached our exclusive economic zone. At this moment, we can say that there is no direct threat to our country,"" Kyodo quoted a source in the government as saying.",True,"[('Source-1', 'source in the government', 166), ('Action-1', 'saying', 194)]",[],True,0-Make a Statement,0-1 Make Public Statement,,,,,False,[],[],True,"[('Source-1', 'government', 180), ('Action-1', 'saying', 194)]","[[('Source-1', 'government'), ('Action-1', 'saying')]]",True,0-Make a Statement,0-1 Make Public Statement,,,,,True,"[('Source-1', 'Kyodo', 151), ('Action-1', 'quoted', 157), ('Target-1', 'source in the government', 166)]","[[('Source-1', 'Kyodo'), ('Action-1', 'quoted')], [('Action-1', 'quoted'), ('Target-1', 'source in the government')]]",True,0-Make a Statement,0-1 Make Public Statement,,,,,True,"[('Source-1', 'Kyodo', 151), ('Action-1', 'quoted', 157), ('Source-2', 'source in the government', 166), ('Target-1', 'source in the government', 166), ('Action-2', 'saying', 194)]","[[('Source-1', 'Kyodo'), ('Action-1', 'quoted')], [('Source-2', 'source in the government'), ('Action-2', 'saying')], [('Action-1', 'quoted'), ('Source-2', 'source in the government')]]",True,0-Make a Statement,0-1 Make Public Statement,0-Make a Statement,0-1 Make Public Statement,,,,
aqMgOr50HcVkWQTrD3qajkb.UymS-cameo_100.csv_32,"No. 53 sentences U.S. President Donald Trump delivers remarks to U.S. troops in an unannounced visit to Bagram Air Base, Afghanistan, November 28, 2019.",No. 53 ,"U.S. President Donald Trump delivers remarks to U.S. troops in an unannounced visit to Bagram Air Base, Afghanistan, November 28, 2019.",True,"[('Source-1', 'U.S. President Donald Trump', 0), ('Action-1', 'delivers remarks', 28), ('Target-1', 'U.S. troops', 48), ('Action-1', 'unannounced visit', 66), ('Location', 'Bagram Air Base, Afghanistan', 87), ('Time', 'November 28, 2019', 117)]","[[('Source-1', 'U.S. President Donald Trump'), ('Action-1', 'delivers remarks')], [('Action-1', 'unannounced visit'), ('Source-1', 'U.S. President Donald Trump')], [('Target-1', 'U.S. troops'), ('Action-1', 'delivers remarks')]]",True,0-Make a Statement,0-1 Make Public Statement,,,,,False,[],[],True,"[('Source-1', 'U.S. President Donald Trump', 0), ('Action-1', 'delivers remarks', 28), ('Target-1', 'U.S. troops', 48), ('Action-2', 'unannounced visit to Bagram Air Base', 66), ('Location', 'Afghanistan', 104), ('Time', 'November 28, 2019', 117)]","[[('Source-1', 'U.S. President Donald Trump'), ('Action-1', 'delivers remarks')], [('Action-1', 'delivers remarks'), ('Target-1', 'U.S. troops')], [('Source-1', 'U.S. President Donald Trump'), ('Action-2', 'unannounced visit to Bagram Air Base')]]",True,0-Make a Statement,0-1 Make Public Statement,0-Make a Statement,0-1 Make Public Statement,,,True,"[('Source-1', 'U.S. President Donald Trump', 0), ('Action-1', 'delivers remarks', 28), ('Target-1', 'U.S. troops', 48), ('Location', 'Bagram Air Base, Afghanistan', 87), ('Time', 'November 28, 2019', 117)]","[[('Source-1', 'U.S. President Donald Trump'), ('Action-1', 'delivers remarks')], [('Action-1', 'delivers remarks'), ('Target-1', 'U.S. troops')]]",True,0-Make a Statement,0-1 Make Public Statement,,,,,True,"[('Source-1', 'U.S. President Donald Trump', 0), ('Action-1', 'delivers remarks', 28), ('Target-1', 'U.S. troops', 48), ('Location', 'Bagram Air Base, Afghanistan', 87), ('Time', 'November 28, 2019', 117)]","[[('Source-1', 'U.S. President Donald Trump'), ('Action-1', 'delivers remarks')], [('Action-1', 'delivers remarks'), ('Target-1', 'U.S. troops')]]",True,0-Make a Statement,0-1 Make Public Statement,,,,,,
ak3i6muEqGdgXrPrtLl5v0Xq2nJq-cameo_100.csv_30,"No. 9 sentences BAGHDAD, April 9 (Xinhua) -- At least two security forces members were killed and seven others injured Monday in a clash with four suicide bombers from the extremist Islamic State (IS) group in the western Iraqi province of Anbar, a local security source s",No. 9 ,"BAGHDAD, April 9 (Xinhua) -- At least two security forces members were killed and seven others injured Monday in a clash with four suicide bombers from the extremist Islamic State (IS) group in the western Iraqi province of Anbar, a local security source s",True,"[('Time', 'April 9', 9), ('Target-1', 'security forces', 42), ('Action-1', 'killed', 71), ('Action-2', 'injured', 95), ('Source-1', 'suicide bombers', 131), ('Location', 'western Iraqi province of Anbar', 198)]","[[('Source-1', 'suicide bombers'), ('Action-1', 'killed')], [('Target-1', 'security forces'), ('Action-1', 'killed')], [('Source-1', 'suicide bombers'), ('Action-2', 'injured')], [('Target-1', 'security forces'), ('Action-2', 'injured')]]",True,4-Material Conflict,4-18 Assualt,,,,,False,[],[],True,"[('Location', 'BAGHDAD', 0), ('Time', 'April 9', 9), ('Target-1', 'security forces members', 42), ('Action-1', 'killed', 71), ('Target-1', 'others', 88), ('Action-1', 'injured', 95), ('Time', 'Monday', 103), ('Action-1', 'clash', 115), ('Source-1', 'suicide bombers from the extremist Islamic State (IS) group', 131), ('Location', 'western Iraqi province of Anbar', 198)]","[[('Source-1', 'suicide bombers from the extremist Islamic State (IS) group'), ('Action-1', 'clash')], [('Source-1', 'suicide bombers from the extremist Islamic State (IS) group'), ('Action-1', 'injured')], [('Source-1', 'suicide bombers from the extremist Islamic State (IS) group'), ('Action-1', 'killed')], [('Action-1', 'killed'), ('Target-1', 'security forces members')], [('Action-1', 'injured'), ('Target-1', 'others')], [('Action-1', 'clash'), ('Target-1', 'security forces members')], [('Action-1', 'clash'), ('Target-1', 'others')]]",True,4-Material Conflict,4-18 Assualt,,,,,True,"[('Location', 'BAGHDAD', 0), ('Time', 'April 9', 9), ('Target-1', 'two security forces members', 38), ('Action-1', 'killed', 71), ('Target-1', 'seven others', 82), ('Action-1', 'injured', 95), ('Time', 'Monday', 103), ('Source-1', 'four suicide bombers from the extremist Islamic State (IS) group', 126), ('Location', 'western Iraqi province of Anbar', 198)]","[[('Source-1', 'four suicide bombers from the extremist Islamic State (IS) group'), ('Action-1', 'killed')], [('Source-1', 'four suicide bombers from the extremist Islamic State (IS) group'), ('Action-1', 'injured')], [('Action-1', 'killed'), ('Target-1', 'two security forces members')], [('Action-1', 'injured'), ('Target-1', 'seven others')]]",True,4-Material Conflict,4-19 Fight,,,,,True,"[('Target-1', 'security forces members', 42), ('Action-1', 'killed', 71), ('Target-1', 'others', 88), ('Action-1', 'injured', 95), ('Time', 'Monday', 103), ('Source-1', 'suicide bombers from the extremist Islamic State (IS) group', 131), ('Location', 'western Iraqi province of Anbar', 198)]","[[('Source-1', 'suicide bombers from the extremist Islamic State (IS) group'), ('Action-1', 'injured')], [('Source-1', 'suicide bombers from the extremist Islamic State (IS) group'), ('Action-1', 'killed')], [('Action-1', 'killed'), ('Target-1', 'security forces members')], [('Action-1', 'injured'), ('Target-1', 'others')]]",True,4-Material Conflict,4-18 Assualt,,,,,,
azP0jHxKVLoHjWWsw92DTiKL8iIu-cameo_100.csv_29,No. 60 sentences Tough new lockdown restrictions on social gatherings across England are to be announced on Wednesday as British Prime Minister Boris Johnson tries to control a resurgence of coronavirus infections.,No. 60 ,Tough new lockdown restrictions on social gatherings across England are to be announced on Wednesday as British Prime Minister Boris Johnson tries to control a resurgence of coronavirus infections.,True,[],[],False,,,,,,,False,[],[],True,[],[],False,,,,,,,True,[],[],False,,,,,,,True,[],[],False,,,,,,,,
aGnJ23ujegnQYuXYDoiRPPVKLJsO-cameo_100.csv_25,"No. 30 sentences TOWER, Minn. (AP) -- Two former officials in the northern Minnesota city of Tower are charged with criminal misconduct for allegedly trying to oust a newspaper publisher from a city agency.",No. 30 ,"TOWER, Minn. (AP) -- Two former officials in the northern Minnesota city of Tower are charged with criminal misconduct for allegedly trying to oust a newspaper publisher from a city agency.",True,"[('Source-1', 'former officials', 25), ('Location', 'northern Minnesota city of Tower', 49), ('Action-1', 'charged', 86), ('Action-1', 'criminal misconduct for allegedly trying to oust a newspaper publisher from a city agency', 99)]","[[('Source-1', 'former officials'), ('Action-1', 'charged')], [('Action-1', 'criminal misconduct for allegedly trying to oust a newspaper publisher from a city agency'), ('Source-1', 'former officials')]]",True,4-Material Conflict,3-11 Disapprove,,,,,False,[],[],True,"[('Location', 'TOWER, Minn.', 0), ('Target-1', 'former officials', 25), ('Location', 'northern Minnesota city of Tower', 49), ('Action-1', 'charged with criminal misconduct', 86), ('Action-2', 'allegedly trying to oust', 123), ('Target-2', 'newspaper publisher', 150)]","[[('Action-1', 'charged with criminal misconduct'), ('Target-1', 'former officials')], [('Action-2', 'allegedly trying to oust'), ('Target-2', 'newspaper publisher')], [('Target-1', 'former officials'), ('Action-2', 'allegedly trying to oust')]]",True,4-Material Conflict,4-17 Coerce,4-Material Conflict,4-17 Coerce,,,True,"[('Location', 'TOWER, Minn.', 0), ('Target-1', 'Two former officials', 21), ('Source-2', 'Two former officials', 21), ('Action-1', 'charged with criminal misconduct', 86), ('Action-2', 'trying to oust', 133), ('Target-2', 'newspaper publisher from a city agency', 150)]","[[('Action-1', 'charged with criminal misconduct'), ('Target-1', 'Two former officials')], [('Source-2', 'Two former officials'), ('Action-2', 'trying to oust')], [('Action-2', 'trying to oust'), ('Target-2', 'newspaper publisher from a city agency')]]",True,4-Material Conflict,4-17 Coerce,4-Material Conflict,4-15 Exhibit Force Posture,,,True,"[('Target-1', 'former officials', 25), ('Source-2', 'former officials', 25), ('Location', 'northern Minnesota city of Tower', 49), ('Action-1', 'are charged', 82), ('Action-2', 'trying to oust', 133), ('Target-2', 'newspaper publisher', 150)]","[[('Source-2', 'former officials'), ('Action-2', 'trying to oust')], [('Action-2', 'trying to oust'), ('Target-2', 'newspaper publisher')], [('Source-2', 'former officials'), ('Action-1', 'are charged')]]",True,4-Material Conflict,4-17 Coerce,3-Verbal Conflict,3-13 Threaten,,,,
