ids,plain_text,No,sentences,anncomplete_1,entities_1,relations_1,1_Relevant_1,Action1-PentaClass_1,Action1_CAMEO_1,Action2-PentaClass_1,Action2_CAMEO_1,Action3-PentaClass_1,Action3_CAMEO_1,anncomplete_2,entities_2,relations_2,anncomplete_3,entities_3,relations_3,1_Relevant_3,Action1-PentaClass_3,Action1_CAMEO_3,Action2-PentaClass_3,Action2_CAMEO_3,Action3_CAMEO_3,Action3-PentaClass_3,anncomplete_4,entities_4,relations_4,1_Relevant_4,Action1-PentaClass_4,Action1_CAMEO_4,Action2-PentaClass_4,Action2_CAMEO_4,Action3-PentaClass_4,Action3_CAMEO_4,anncomplete_5,entities_5,relations_5,1_Relevant_5,Action1-PentaClass_5,Action1_CAMEO_5,Action2-PentaClass_5,Action2_CAMEO_5,Action3-PentaClass_5,Action3_CAMEO_5,Action4-PentaClass_5,Action4_CAMEO_5
aWsy2qUnKzrNRQsiVkEysGEOEche-cameo_100.csv_99,"No. 47 sentences Four men have been charged with murder in connection with the slaying of a man at a marijuana grow-house near Hayward in February, authorities said Friday.",No. 47 ,"Four men have been charged with murder in connection with the slaying of a man at a marijuana grow-house near Hayward in February, authorities said Friday.",True,[],[],False,,,,,,,False,[],[],True,[],[],False,,,,,,,True,[],[],False,,,,,,,True,[],[],False,,,,,,,,
a0YoUjXjtQcqTQNxt9GYoPHTriM4-cameo_100.csv_97,"No. 75 sentences NEW YORK (Reuters) - Bruce Springsteen was fined $500 on Wednesday after the rock 'n' roll legend pleaded guilty to a charge of consuming alcohol at a federally run New Jersey beach in November, and prosecutors dropped drunken driving and",No. 75 ,"NEW YORK (Reuters) - Bruce Springsteen was fined $500 on Wednesday after the rock 'n' roll legend pleaded guilty to a charge of consuming alcohol at a federally run New Jersey beach in November, and prosecutors dropped drunken driving and",True,[],[],False,,,,,,,False,[],[],True,[],[],False,,,,,,,True,[],[],False,,,,,,,True,[],[],False,,,,,,,,
aXtIzpYCym.iISnbmm8NuBQUJIkq-cameo_100.csv_49,"No. 89 sentences Since coming to power in June of last year, Philippine President Rodrigo Duterte has become one of Asia's most controversial leaders for his strongman politics and inflammatory statements.",No. 89 ,"Since coming to power in June of last year, Philippine President Rodrigo Duterte has become one of Asia's most controversial leaders for his strongman politics and inflammatory statements.",True,[],[],False,,,,,,,False,[],[],True,[],[],False,,,,,,,True,[],[],False,,,,,,,True,[],[],False,,,,,,,,
aJSoFDPcqdgrocDGMyj43Xkk7qky-cameo_100.csv_48,"No. 99 sentences Following the 'ice-breaking' Nawaz-Modi meeting in Ufa, Pakistan and India formally decided to resume the dialogue process between the two countries by issuing a joint communique in July this year.",No. 99 ,"Following the 'ice-breaking' Nawaz-Modi meeting in Ufa, Pakistan and India formally decided to resume the dialogue process between the two countries by issuing a joint communique in July this year.",True,"[('Location', 'Ufa', 51), ('Source-1', 'Pakistan', 56), ('Source-2', 'India', 69), ('Action-1', 'decided to resume the dialogue process', 84), ('Action-2', 'issuing a joint communique', 152), ('Time', 'July', 182)]","[[('Action-1', 'decided to resume the dialogue process'), ('Source-1', 'Pakistan')], [('Source-2', 'India'), ('Action-2', 'issuing a joint communique')], [('Source-1', 'Pakistan'), ('Action-2', 'issuing a joint communique')], [('Source-2', 'India'), ('Action-1', 'decided to resume the dialogue process')]]",True,1-Verbal Cooperation,1-3 Express Intent to Coop,0-Make a Statement,0-1 Make Public Statement,,,False,[],[],True,"[('Source-1', 'Nawaz', 29), ('Target-1', 'Modi', 35), ('Action-1', 'meeting', 40), ('Location', 'Ufa', 51), ('Source-1', 'Pakistan', 56), ('Target-1', 'India', 69), ('Action-1', 'resume the dialogue', 95), ('Source-2', 'two countries', 135), ('Action-2', 'issuing a joint communique', 152), ('Time', 'July', 182)]","[[('Source-1', 'Nawaz'), ('Action-1', 'meeting')], [('Source-1', 'Nawaz'), ('Action-1', 'resume the dialogue')], [('Source-1', 'Pakistan'), ('Action-1', 'meeting')], [('Source-1', 'Pakistan'), ('Action-1', 'resume the dialogue')], [('Action-1', 'meeting'), ('Target-1', 'Modi')], [('Action-1', 'meeting'), ('Target-1', 'India')], [('Action-1', 'resume the dialogue'), ('Target-1', 'Modi')], [('Action-1', 'resume the dialogue'), ('Target-1', 'India')], [('Source-2', 'two countries'), ('Action-2', 'issuing a joint communique')]]",True,1-Verbal Cooperation,1-3 Express Intent to Coop,0-Make a Statement,0-1 Make Public Statement,,,True,"[('Location', 'Ufa', 51), ('Source-1', 'Pakistan', 56), ('Target-1', 'India', 69), ('Action-1', 'resume the dialogue process', 95), ('Source-2', 'two countries', 135), ('Action-2', 'issuing a joint communique', 152), ('Time', 'July', 182)]","[[('Source-1', 'Pakistan'), ('Action-1', 'resume the dialogue process')], [('Action-1', 'resume the dialogue process'), ('Target-1', 'India')], [('Source-2', 'two countries'), ('Action-2', 'issuing a joint communique')]]",True,1-Verbal Cooperation,1-3 Express Intent to Coop,0-Make a Statement,0-1 Make Public Statement,,,True,"[('Source-1', 'Nawaz', 29), ('Target-1', 'Modi', 35), ('Location', 'Ufa', 51), ('Source-1', 'Pakistan', 56), ('Target-1', 'India', 69), ('Action-1', 'resume the dialogue process', 95), ('Action-1', 'issuing a joint communique', 152), ('Time', 'July this year', 182)]","[[('Source-1', 'Nawaz'), ('Action-1', 'resume the dialogue process')], [('Source-1', 'Nawaz'), ('Action-1', 'issuing a joint communique')], [('Source-1', 'Pakistan'), ('Action-1', 'resume the dialogue process')], [('Source-1', 'Pakistan'), ('Action-1', 'issuing a joint communique')], [('Action-1', 'resume the dialogue process'), ('Target-1', 'Modi')], [('Action-1', 'resume the dialogue process'), ('Target-1', 'India')], [('Action-1', 'issuing a joint communique'), ('Target-1', 'Modi')], [('Action-1', 'issuing a joint communique'), ('Target-1', 'India')]]",True,1-Verbal Cooperation,1-3 Express Intent to Coop,,,,,,
auuBYpb9_YxSVddb3kwBAVvcw4hu-cameo_100.csv_50,"No. 58 sentences ISLAMABAD: In India, Congress general secretary Priyanka Gandhi Vadra says Jammu and Kashmir has been under dictatorship for the past one year.",No. 58 ,"ISLAMABAD: In India, Congress general secretary Priyanka Gandhi Vadra says Jammu and Kashmir has been under dictatorship for the past one year.",True,"[('Location', 'India', 14), ('Source-1', 'Congress general secretary', 21), ('Action-1', 'says', 70), ('Target-1', 'Jammu', 75), ('Target-2', 'Kashmir', 85), ('Action-2', 'under dictatorship', 102), ('Target-1', 'past one year', 129)]","[[('Source-1', 'Congress general secretary'), ('Action-1', 'says')], [('Target-2', 'Kashmir'), ('Action-2', 'under dictatorship')], [('Target-1', 'Jammu'), ('Action-2', 'under dictatorship')]]",True,0-Make a Statement,0-1 Make Public Statement,4-Material Conflict,4-15 Exhibit Force Posture,,,False,[],[],True,"[('Location', 'India', 14), ('Source-1', 'Congress general secretary Priyanka Gandhi Vadra', 21), ('Action-1', 'says', 70)]","[[('Source-1', 'Congress general secretary Priyanka Gandhi Vadra'), ('Action-1', 'says')]]",True,0-Make a Statement,0-1 Make Public Statement,,,,,True,"[('Location', 'ISLAMABAD', 0), ('Location', 'India', 14), ('Source-1', 'Congress general secretary Priyanka Gandhi Vadra', 21), ('Action-1', 'says', 70), ('Target-2', 'Jammu and Kashmir', 75), ('Action-2', 'has been under dictatorship', 93), ('Time', 'past one year', 129)]","[[('Source-1', 'Congress general secretary Priyanka Gandhi Vadra'), ('Action-1', 'says')], [('Action-2', 'has been under dictatorship'), ('Target-2', 'Jammu and Kashmir')]]",True,0-Make a Statement,0-1 Make Public Statement,4-Material Conflict,4-15 Exhibit Force Posture,,,True,"[('Location', 'India', 14), ('Source-1', 'Congress general secretary Priyanka Gandhi Vadra', 21), ('Action-1', 'says', 70), ('Target-2', 'Jammu', 75), ('Target-2', 'Kashmir', 85), ('Action-2', 'has been under dictatorship', 93), ('Time', 'past one year', 129)]","[[('Source-1', 'Congress general secretary Priyanka Gandhi Vadra'), ('Action-1', 'says')], [('Action-2', 'has been under dictatorship'), ('Target-2', 'Kashmir')], [('Action-2', 'has been under dictatorship'), ('Target-2', 'Jammu')]]",True,0-Make a Statement,0-1 Make Public Statement,4-Material Conflict,4-17 Coerce,,,,
abRtyyFZzh4O8SyqLVwfB6vVHF0m-cameo_100.csv_100,"No. 29 sentences FILE - In this Sept. 9, 2020, file photo U.S. Attorney Thomas Kirsch for the Northern District of Indiana listens during a news conference at the Dirksen Federal Building in Chicago.",No. 29 ,"FILE - In this Sept. 9, 2020, file photo U.S. Attorney Thomas Kirsch for the Northern District of Indiana listens during a news conference at the Dirksen Federal Building in Chicago.",True,[],[],False,,,,,,,False,[],[],True,[],[],False,,,,,,,True,[],[],False,,,,,,,True,[],[],False,,,,,,,,
ar_b9PMZECNO4mt1gGXoC2F0cGmm-cameo_100.csv_43,"No. 61 sentences FATEHGARH SAHIB: A youth hailing from Khant village near Khamano town of Fategarh Sahib district, was found dead at a dairy farm in Verona district of Italy, his family said on Tuesday.",No. 61 ,"FATEHGARH SAHIB: A youth hailing from Khant village near Khamano town of Fategarh Sahib district, was found dead at a dairy farm in Verona district of Italy, his family said on Tuesday.",True,[],[],False,,,,,,,False,[],[],True,[],[],False,,,,,,,True,[],[],False,,,,,,,True,[],[],False,,,,,,,,
aW9c84qBNewTcl_CC7vWCHwQhaqO-cameo_100.csv_47,No. 31 sentences More Than A Dozen GOP State Lawmakers Attended Rally That Gave Way To Riots,No. 31 ,More Than A Dozen GOP State Lawmakers Attended Rally That Gave Way To Riots,True,"[('Source-1', 'GOP State Lawmakers', 18), ('Action-1', 'Attended Rally', 38)]",[],True,4-Material Conflict,4-14 Protest,,,,,False,[],[],True,"[('Source-1', 'GOP State Lawmakers', 18), ('Action-1', 'Attended Rally That Gave Way To Riots', 38)]","[[('Source-1', 'GOP State Lawmakers'), ('Action-1', 'Attended Rally That Gave Way To Riots')]]",True,4-Material Conflict,4-14 Protest,,,,,True,"[('Source-1', 'GOP State Lawmakers', 18), ('Action-1', 'Attended Rally', 38), ('Target-1', 'That Gave Way To Riots', 53)]","[[('Source-1', 'GOP State Lawmakers'), ('Action-1', 'Attended Rally')], [('Action-1', 'Attended Rally'), ('Target-1', 'That Gave Way To Riots')]]",True,4-Material Conflict,4-14 Protest,,,,,True,"[('Source-1', 'GOP State Lawmakers', 18), ('Action-1', 'Attended Rally', 38)]","[[('Source-1', 'GOP State Lawmakers'), ('Action-1', 'Attended Rally')]]",True,1-Verbal Cooperation,1-4 Consult,,,,,,
aFTh8u0IAhIfaoBwgMSfBHrGgic0-cameo_100.csv_46,No. 1 sentences U.S. Associate Justice Ruth Bader Ginsburg was hospitalized Thursday evening after she became ill following treatment for an iron deficiency.,No. 1 ,U.S. Associate Justice Ruth Bader Ginsburg was hospitalized Thursday evening after she became ill following treatment for an iron deficiency.,True,[],[],False,,,,,,,False,[],[],True,[],[],False,,,,,,,True,[],[],False,,,,,,,True,[],[],False,,,,,,,,
a3EzdBAERoOXb3NAg7Y2KG1lX4py-cameo_100.csv_95,"No. 8 sentences U.S. public health officials, psychiatrists, grieving parents, outraged former patients and others are addressing the most bitterly divisive question in psychiatry: Do the drugs that doctors prescribe to relieve depression make some people more likely to c",No. 8 ,"U.S. public health officials, psychiatrists, grieving parents, outraged former patients and others are addressing the most bitterly divisive question in psychiatry: Do the drugs that doctors prescribe to relieve depression make some people more likely to c",True,[],[],False,,,,,,,False,[],[],True,[],[],False,,,,,,,True,[],[],False,,,,,,,True,[],[],False,,,,,,,,
aW_qGP.4J2VXUCk8l7fx6aDjPaKW-cameo_100.csv_98,"No. 45 sentences Venezuela's ruling Socialist Party swept the country's Dec. 10 municipal elections, winning 300 of 339 races for mayor, including in 39 of the country's 40 biggest cities.",No. 45 ,"Venezuela's ruling Socialist Party swept the country's Dec. 10 municipal elections, winning 300 of 339 races for mayor, including in 39 of the country's 40 biggest cities.",True,[],[],False,,,,,,,False,[],[],True,[],[],False,,,,,,,True,[],[],False,,,,,,,True,"[('Source-1', ""Venezuela's ruling Socialist Party"", 0), ('Action-1', 'swept the country', 35), ('Time', 'Dec. 10', 55), ('Action-1', 'winning', 84)]",[],True,2-Material Cooperation,2-6 Engage in Material Coop,,,,,,
avJ.VYEQxqLIdZoiHOAr7Zhdi6pu-cameo_100.csv_91,"No. 98 sentences Britain's left-wing Labour leader, Jeremy Corbyn, was dismissed by many as a political no-hoper but with the General Election on course for political deadlock he could conceivably become the U.K.'s next prime minister.",No. 98 ,"Britain's left-wing Labour leader, Jeremy Corbyn, was dismissed by many as a political no-hoper but with the General Election on course for political deadlock he could conceivably become the U.K.'s next prime minister.",True,[],[],False,,,,,,,False,[],[],True,[],[],False,,,,,,,True,[],[],False,,,,,,,True,[],[],False,,,,,,,,
aTsyCEpGsRTfCpcrA8ZI0ODsp0mG-cameo_100.csv_92,"No. 83 sentences ""A competent professional, an experienced and responsible executive, you are doing your best to consolidate the team around the most important and essential goals and set the bar high in your work,"" Putin said in a congratulatory telegram to Mikhailov.",No. 83 ,"""A competent professional, an experienced and responsible executive, you are doing your best to consolidate the team around the most important and essential goals and set the bar high in your work,"" Putin said in a congratulatory telegram to Mikhailov.",True,"[('Source-1', 'Putin', 199), ('Action-1', 'said', 205), ('Target-1', 'Mikhailov', 242)]","[[('Source-1', 'Putin'), ('Action-1', 'said')]]",True,0-Make a Statement,0-1 Make Public Statement,,,,,False,[],[],True,"[('Source-1', 'Putin', 199), ('Action-1', 'said in a congratulatory telegram', 205), ('Target-1', 'Mikhailov', 242)]","[[('Source-1', 'Putin'), ('Action-1', 'said in a congratulatory telegram')], [('Action-1', 'said in a congratulatory telegram'), ('Target-1', 'Mikhailov')]]",True,0-Make a Statement,0-1 Make Public Statement,,,,,True,"[('Source-1', 'Putin', 199), ('Action-1', 'said', 205), ('Target-1', 'Mikhailov', 242)]","[[('Source-1', 'Putin'), ('Action-1', 'said')], [('Action-1', 'said'), ('Target-1', 'Mikhailov')]]",True,0-Make a Statement,0-1 Make Public Statement,,,,,True,"[('Source-1', 'Putin', 199), ('Action-1', 'said', 205), ('Target-1', 'Mikhailov', 242)]","[[('Source-1', 'Putin'), ('Action-1', 'said')], [('Action-1', 'said'), ('Target-1', 'Mikhailov')]]",True,0-Make a Statement,0-1 Make Public Statement,,,,,,
a98fFjoK8Dc3KrSTDuXav6T17YrK-cameo_100.csv_88,"No. 34 sentences Thick black smoke and towering orange flames shot up Friday after two trailers of highly unstable compounds blew up at a flooded Houston-area chemical plant, the second fire there in two days.",No. 34 ,"Thick black smoke and towering orange flames shot up Friday after two trailers of highly unstable compounds blew up at a flooded Houston-area chemical plant, the second fire there in two days.",True,[],[],False,,,,,,,False,[],[],True,[],[],False,,,,,,,True,[],[],False,,,,,,,True,[],[],False,,,,,,,,
acoRvxr92FPz.ZtxkzmkmFckHNxm-cameo_100.csv_94,"No. 64 sentences President Donald Trump talks with House Speaker Paul Ryan (R-WI) as he promotes a newly unveiled Republican tax plan with House Republican leaders in the Cabinet Room of the White House in Washington, November 2, 2017.",No. 64 ,"President Donald Trump talks with House Speaker Paul Ryan (R-WI) as he promotes a newly unveiled Republican tax plan with House Republican leaders in the Cabinet Room of the White House in Washington, November 2, 2017.",True,"[('Source-1', 'President Donald Trump', 0), ('Action-1', 'talks', 23), ('Target-1', 'House Speaker Paul Ryan', 34), ('Action-2', 'promotes a newly unveiled Republican tax plan', 71), ('Target-2', 'House Republican leaders', 122), ('Location', 'Washington', 189), ('Time', 'November 2, 2017', 201)]","[[('Source-1', 'President Donald Trump'), ('Action-1', 'talks')], [('Target-1', 'House Speaker Paul Ryan'), ('Action-1', 'talks')], [('Source-1', 'President Donald Trump'), ('Action-2', 'promotes a newly unveiled Republican tax plan')]]",True,1-Verbal Cooperation,1-4 Consult,1-Verbal Cooperation,1-3 Express Intent to Coop,,,False,[],[],True,"[('Source-1', 'President Donald Trump', 0), ('Action-1', 'talks with', 23), ('Target-1', 'House Speaker Paul Ryan', 34), ('Action-2', 'promotes a newly unveiled Republican tax plan', 71), ('Target-2', 'House Republican leaders', 122), ('Location', 'Washington', 189), ('Time', 'November 2, 2017', 201)]","[[('Source-1', 'President Donald Trump'), ('Action-1', 'talks with')], [('Action-1', 'talks with'), ('Target-1', 'House Speaker Paul Ryan')], [('Action-2', 'promotes a newly unveiled Republican tax plan'), ('Target-2', 'House Republican leaders')], [('Source-1', 'President Donald Trump'), ('Action-2', 'promotes a newly unveiled Republican tax plan')]]",True,1-Verbal Cooperation,1-3 Express Intent to Coop,1-Verbal Cooperation,1-3 Express Intent to Coop,,,True,"[('Source-1', 'President Donald Trump', 0), ('Action-1', 'promotes', 71), ('Target-1', 'newly unveiled Republican tax plan', 82), ('Location', 'White House in Washington', 174), ('Time', 'November 2, 2017', 201)]","[[('Source-1', 'President Donald Trump'), ('Action-1', 'promotes')], [('Action-1', 'promotes'), ('Target-1', 'newly unveiled Republican tax plan')]]",True,1-Verbal Cooperation,0-1 Make Public Statement,,,,,True,"[('Source-1', 'President Donald Trump', 0), ('Action-1', 'talks with', 23), ('Target-1', 'House Speaker Paul Ryan', 34), ('Action-2', 'promotes a newly unveiled Republican tax plan with', 71), ('Target-2', 'House Republican leaders', 122), ('Location', 'Cabinet Room of the White House in Washington', 154), ('Time', 'November 2, 2017', 201)]","[[('Source-1', 'President Donald Trump'), ('Action-1', 'talks with')], [('Action-1', 'talks with'), ('Target-1', 'House Speaker Paul Ryan')], [('Action-2', 'promotes a newly unveiled Republican tax plan with'), ('Target-2', 'House Republican leaders')], [('Source-1', 'President Donald Trump'), ('Action-2', 'promotes a newly unveiled Republican tax plan with')]]",True,1-Verbal Cooperation,1-4 Consult,1-Verbal Cooperation,0-2 Appeal,,,,
aOkY6GWIuIWjzcZkVkp9EFVaUh_m-cameo_100.csv_93,"No. 74 sentences Fethi Belaid, AFP | A member of the Tunisian security forces aims his weapon at protesters during clashes in the outskirts of Tunis late on January 10, 2018.",No. 74 ,"Fethi Belaid, AFP | A member of the Tunisian security forces aims his weapon at protesters during clashes in the outskirts of Tunis late on January 10, 2018.",True,"[('Source-1', 'member of the Tunisian security forces', 22), ('Action-1', 'aims his weapon', 61), ('Target-1', 'protesters', 80), ('Action-1', 'during clashes', 91), ('Location', 'outskirts of Tunis', 113), ('Time', 'January 10, 2018', 140)]","[[('Source-1', 'member of the Tunisian security forces'), ('Action-1', 'aims his weapon')], [('Action-1', 'during clashes'), ('Source-1', 'member of the Tunisian security forces')], [('Action-1', 'aims his weapon'), ('Target-1', 'protesters')], [('Action-1', 'during clashes'), ('Target-1', 'protesters')]]",True,4-Material Conflict,4-15 Exhibit Force Posture,,,,,False,[],[],True,"[('Source-1', 'member of the Tunisian security forces', 22), ('Action-1', 'aims his weapon', 61), ('Target-1', 'protesters', 80), ('Location', 'Tunis', 126), ('Time', 'January 10, 2018', 140)]","[[('Source-1', 'member of the Tunisian security forces'), ('Action-1', 'aims his weapon')], [('Action-1', 'aims his weapon'), ('Target-1', 'protesters')]]",True,4-Material Conflict,4-15 Exhibit Force Posture,,,,,True,"[('Source-1', 'A member of the Tunisian security forces', 20), ('Action-1', 'aims his weapon', 61), ('Target-1', 'protesters', 80), ('Location', 'outskirts of Tunis', 113), ('Time', 'January 10, 2018', 140)]","[[('Source-1', 'A member of the Tunisian security forces'), ('Action-1', 'aims his weapon')], [('Action-1', 'aims his weapon'), ('Target-1', 'protesters')]]",True,4-Material Conflict,4-15 Exhibit Force Posture,,,,,True,"[('Source-1', 'member of the Tunisian security forces', 22), ('Action-1', 'aims his weapon', 61), ('Target-1', 'protesters', 80), ('Location', 'outskirts of Tunis', 113), ('Time', 'January 10, 2018', 140)]","[[('Source-1', 'member of the Tunisian security forces'), ('Action-1', 'aims his weapon')], [('Action-1', 'aims his weapon'), ('Target-1', 'protesters')]]",True,3-Verbal Conflict,3-13 Threaten,,,,,,
avGardplC8_A3yarO9pu6LgwK2oS-cameo_100.csv_89,No. 96 sentences A huge defunct German satellite is expected to plunge to Earth this weekend and the Federal Aviation Administration wants pilots to be on the lookout for any space debris from the falling spacecraft.,No. 96 ,A huge defunct German satellite is expected to plunge to Earth this weekend and the Federal Aviation Administration wants pilots to be on the lookout for any space debris from the falling spacecraft.,True,[],[],False,,,,,,,False,[],[],True,[],[],False,,,,,,,True,[],[],False,,,,,,,True,[],[],False,,,,,,,,
aZiKEav2PCt08zoI.VKp71MJmAhm-cameo_100.csv_87,No. 65 sentences A corruption scandal has shaken Venezuela's financial system and triggered the arrest of tycoons who are linked to President Hugo Chavez's government.,No. 65 ,A corruption scandal has shaken Venezuela's financial system and triggered the arrest of tycoons who are linked to President Hugo Chavez's government.,True,"[('Source-1', 'corruption scandal', 2), ('Action-1', 'shaken', 25), ('Location', 'Venezuel', 32), ('Target-1', ""Venezuela's financial system"", 32), ('Action-2', 'triggered the arrest of tycoons', 65), ('Target-2', ""tycoons who are linked to President Hugo Chavez's government"", 89)]",[],True,3-Verbal Conflict,3-13 Threaten,4-Material Conflict,4-15 Exhibit Force Posture,,,False,[],[],True,"[('Source-1', 'corruption scandal', 2), ('Location', 'Venezuela', 32), ('Action-1', 'triggered the arrest', 65), ('Target-1', ""tycoons who are linked to President Hugo Chavez's government"", 89)]","[[('Source-1', 'corruption scandal'), ('Action-1', 'triggered the arrest')], [('Action-1', 'triggered the arrest'), ('Target-1', ""tycoons who are linked to President Hugo Chavez's government"")]]",True,4-Material Conflict,4-17 Coerce,,,,,True,"[('Source-1', 'corruption scandal', 2), ('Source-2', 'corruption scandal', 2), ('Action-1', 'shaken', 25), ('Target-1', ""Venezuela's financial system"", 32), ('Action-2', 'triggered the arrest', 65), ('Target-2', ""tycoons who are linked to President Hugo Chavez's government."", 89)]","[[('Source-1', 'corruption scandal'), ('Action-1', 'shaken')], [('Action-1', 'shaken'), ('Target-1', ""Venezuela's financial system"")], [('Action-2', 'triggered the arrest'), ('Target-2', ""tycoons who are linked to President Hugo Chavez's government."")], [('Source-1', 'corruption scandal'), ('Action-2', 'triggered the arrest')]]",True,4-Material Conflict,4-15 Exhibit Force Posture,4-Material Conflict,4-17 Coerce,,,True,"[('Action-1', 'arrest', 79), ('Target-1', ""tycoons who are linked to President Hugo Chavez's government"", 89)]","[[('Action-1', 'arrest'), ('Target-1', ""tycoons who are linked to President Hugo Chavez's government"")]]",True,4-Material Conflict,4-17 Coerce,,,,,,
aXvkwxUDcSiGHvQcQKiRs6CYXuIy-cameo_100.csv_90,"No. 72 sentences In recent months, the UK has been gripped by cases of widespread organised child abuse - in Rotherham, Oxford, Rochdale and even Westminster.",No. 72 ,"In recent months, the UK has been gripped by cases of widespread organised child abuse - in Rotherham, Oxford, Rochdale and even Westminster.",True,[],[],False,,,,,,,False,[],[],True,[],[],False,,,,,,,True,[],[],False,,,,,,,True,[],[],False,,,,,,,,
a1orQqVNHb0DNZOiDq0KC4F079Cq-cameo_100.csv_86,No. 54 sentences Greeks went to the polls on Sunday in the first general election since the start of the country's debt crisis.,No. 54 ,Greeks went to the polls on Sunday in the first general election since the start of the country's debt crisis.,True,[],[],False,,,,,,,False,[],[],True,[],[],False,,,,,,,True,[],[],False,,,,,,,True,"[('Source-1', 'Greeks', 0), ('Action-1', 'went to the polls', 7), ('Time', 'Sunday', 28)]","[[('Source-1', 'Greeks'), ('Action-1', 'went to the polls')]]",True,2-Material Cooperation,2-6 Engage in Material Coop,,,,,,
aNquOmrvi_NA65lBr9WmiNmX42VW-cameo_100.csv_82,"No. 12 sentences An Oakland woman was fatally stabbed in front of her children by her estranged boyfriend after Oakland police failed to arrest him when he twice violated a restraining order, a $10 million wrongful-death lawsuit charges.",No. 12 ,"An Oakland woman was fatally stabbed in front of her children by her estranged boyfriend after Oakland police failed to arrest him when he twice violated a restraining order, a $10 million wrongful-death lawsuit charges.",True,[],[],False,,,,,,,False,[],[],True,[],[],False,,,,,,,True,[],[],False,,,,,,,True,[],[],False,,,,,,,,
